{
  "$schema": "./assets-catalog.schema.json",
  "version": "0.3.0",
  "note": "Canon asset catalog for the Scourge universe. Entity sprites are per-game renders of shared canon: each entity lists the games it is intended for (`games`) and a complete per-game `variants` record. A string is a local render, an alias explicitly reuses another game's render, a placeholder records an intended render without artwork yet, and null means the entity is not intended for that game. The 'shared' section lists truly game-agnostic assets every game uses identically.",
  "entities": [
    {
      "id": "scourge-swarm",
      "kind": "entity",
      "name": "Swarm Ripper",
      "faction": "scourge",
      "hostFamily": "rot-flesh",
      "canon": "Fast melee Scourge fodder that floods lanes and breach rooms through numbers and claws.",
      "promptBase": "Scourge melee swarm creature with hunched parasite frame, black chitin over raw muscle, blade-like forearms, toxic-green breach cores, wet gore and exposed sinew.",
      "games": ["scourge-survivors", "deadlane", "pactfall", "redline"],
      "variants": {
        "scourge-survivors": "entities/scourge-swarm/scourge-survivors.webp",
        "deadlane": "entities/scourge-swarm/deadlane.webp",
        "pactfall": "entities/scourge-swarm/pactfall.webp",
        "brawl": null,
        "starblight": null,
        "redline": { "type": "placeholder", "note": "Redline render is intended but has not been produced." },
        "rothulk": null
      }
    },
    {
      "id": "scourge-spitter",
      "kind": "entity",
      "name": "Swarm Spitter",
      "faction": "scourge",
      "hostFamily": "mycelial",
      "canon": "Ranged Scourge form that turns infection into projectile pressure via distended toxic sacs or fused arm-lances.",
      "promptBase": "Scourge ranged creature with thin predatory silhouette, distended toxic-green firing sac or bio-industrial arm lance, black chitin, raw sinew, rusted tech fragments embedded in flesh.",
      "games": ["scourge-survivors", "deadlane", "rothulk"],
      "variants": {
        "scourge-survivors": "entities/scourge-spitter/scourge-survivors.webp",
        "deadlane": "entities/scourge-spitter/deadlane.webp",
        "pactfall": null,
        "brawl": null,
        "starblight": null,
        "redline": null,
        "rothulk": { "type": "placeholder", "note": "Rothulk render is intended but has not been produced." }
      }
    },
    {
      "id": "scourge-elite",
      "kind": "entity",
      "name": "Render",
      "faction": "scourge",
      "hostFamily": "chitin",
      "canon": "Chitin Warhost melee charger that charges in straight lines with armor-piercing carapace, enraging at half health with exposed toxic-green breach nodes.",
      "promptBase": "Scourge elite charger with cracked alien carapace, hunched low-profile silhouette, blade-claw forelimbs, toxic-green parasite nodes at seams, enrage variant shows blood-hot exposed tissue.",
      "games": ["scourge-survivors", "deadlane", "pactfall", "brawl", "redline"],
      "variants": {
        "scourge-survivors": "entities/scourge-elite/scourge-survivors.webp",
        "deadlane": "entities/scourge-elite/deadlane.webp",
        "pactfall": "entities/scourge-elite/pactfall.webp",
        "brawl": { "type": "alias", "sourceGame": "pactfall" },
        "starblight": null,
        "redline": { "type": "placeholder", "note": "Redline render is intended but has not been produced." },
        "rothulk": null
      }
    },
    {
      "id": "graft-breacher",
      "kind": "entity",
      "name": "Graft-Breacher",
      "faction": "scourge",
      "hostFamily": "machine-graft",
      "canon": "Machine-Graft siege elite that walks up and shears through fortifications with a massive demolition claw and tendril-burst secondary attack.",
      "promptBase": "Scourge elite industrial walker frame overtaken by parasite, black chitin threading through riveted metal joints, one massive demolition-claw fused with bone-sinew, toxic-green breach cores at former control panels, asymmetric tendril mass opposite.",
      "games": ["scourge-survivors", "deadlane", "rothulk"],
      "variants": {
        "scourge-survivors": "entities/graft-breacher/scourge-survivors.webp",
        "deadlane": "entities/graft-breacher/deadlane.webp",
        "pactfall": null,
        "brawl": null,
        "starblight": null,
        "redline": null,
        "rothulk": { "type": "placeholder", "note": "Rothulk render is intended but has not been produced." }
      }
    },
    {
      "id": "rot-engine",
      "kind": "entity",
      "name": "Rot-Engine",
      "faction": "scourge",
      "hostFamily": "machine-graft",
      "canon": "Machine-Graft ranged siege elite that dissolves fortifications from standoff with a sustained bile-lance, planted and unhittable until the sac is destroyed.",
      "promptBase": "Scourge elite siege unit with rusted industrial machine chassis infested by parasite, black chitin over burst metal hull, toxic-green bile sac swollen inside engine cavity, organic tendrils pulsing through joints, hollow breached cockpit.",
      "games": ["scourge-survivors", "deadlane", "redline"],
      "variants": {
        "scourge-survivors": "entities/rot-engine/scourge-survivors.webp",
        "deadlane": "entities/rot-engine/deadlane.webp",
        "pactfall": null,
        "brawl": null,
        "starblight": null,
        "redline": { "type": "placeholder", "note": "Redline render is intended but has not been produced." },
        "rothulk": null
      }
    },
    {
      "id": "breach-boss",
      "kind": "boss",
      "name": "Breach-Boss",
      "faction": "scourge",
      "hostFamily": "bone-titan",
      "canon": "Monstrous Scourge expression grown around a breach heart, wielding melee pressure and ranged barrages behind a shield-organ ring.",
      "promptBase": "Scourge breach-boss with huge non-human war body, toxic-green chest core, shield-organ ring, fused rusted metal and wet chitin, massive arms, projectile vents.",
      "games": ["scourge-survivors", "deadlane", "pactfall", "rothulk"],
      "variants": {
        "scourge-survivors": "entities/breach-boss/scourge-survivors.webp",
        "deadlane": "entities/breach-boss/deadlane.webp",
        "pactfall": "entities/breach-boss/pactfall.webp",
        "brawl": null,
        "starblight": null,
        "redline": null,
        "rothulk": { "type": "placeholder", "note": "Rothulk render is intended but has not been produced." }
      }
    },
    {
      "id": "trucebreaker",
      "kind": "boss",
      "name": "Trucebreaker",
      "faction": "scourge",
      "hostFamily": null,
      "canon": "Neutral Scourge arena threat in Pactfall that pressures both Pyre and Wardens equally from broken arena wreckage.",
      "promptBase": "Neutral Scourge arena boss with parasite mass grown over broken arena metal, toxic-green core, chitin and raw tissue, objective monster silhouette readable from top-down view.",
      "games": ["pactfall", "brawl"],
      "variants": {
        "scourge-survivors": null,
        "deadlane": null,
        "pactfall": "entities/trucebreaker/pactfall.webp",
        "brawl": { "type": "alias", "sourceGame": "pactfall" },
        "starblight": null,
        "redline": null,
        "rothulk": null
      }
    },
    {
      "id": "scourge-fighter",
      "kind": "entity",
      "name": "Scourge Fighter",
      "faction": "scourge",
      "hostFamily": "voidship",
      "canon": "Small infected attack craft that flies in arcade formations and mutates pattern behavior as the Starblight run escalates.",
      "promptBase": "Scourge infected small attack craft with rusted hull fused with black chitin and raw tissue, toxic-green parasite core, arcade-readable silhouette, dark parasitic growth.",
      "games": ["starblight"],
      "variants": {
        "scourge-survivors": null,
        "deadlane": null,
        "pactfall": null,
        "brawl": null,
        "starblight": "entities/scourge-fighter/starblight.webp",
        "redline": null,
        "rothulk": null
      }
    },
    {
      "id": "orbital-breach-carrier",
      "kind": "boss",
      "name": "Orbital-Breach-Carrier",
      "faction": "scourge",
      "hostFamily": "voidship",
      "canon": "Starblight orbital boss: a living carrier-ship grown around a breach heart, releasing spore mines and fighter waves while shielding its core.",
      "promptBase": "Scourge orbital carrier boss with infected wreckage grown around toxic-green breach heart, chitin plating over rusted ship ribs, spore vents, raw tissue in broken engines, arcade boss silhouette.",
      "games": ["starblight"],
      "variants": {
        "scourge-survivors": null,
        "deadlane": null,
        "pactfall": null,
        "brawl": null,
        "starblight": "entities/orbital-breach-carrier/starblight.webp",
        "redline": null,
        "rothulk": null
      }
    },
    {
      "id": "pyre-ranger",
      "kind": "entity",
      "name": "Ranger",
      "faction": "pyre",
      "hostFamily": null,
      "canon": "Baseline Pyre Purger operating rifle-first at medium armor and balanced speed for breach descent.",
      "promptBase": "Pyre human Purger, medium armor, rifle, scorched gunmetal, bone ceramic, furnace visor, hellfire orange heat lines, high contrast gunmetal and blood",
      "games": ["scourge-survivors", "pactfall"],
      "variants": {
        "scourge-survivors": "entities/pyre-ranger/scourge-survivors.webp",
        "deadlane": null,
        "pactfall": "entities/pyre-ranger/pactfall.webp",
        "brawl": null,
        "starblight": null,
        "redline": null,
        "rothulk": null
      }
    },
    {
      "id": "pyre-bulwark",
      "kind": "entity",
      "name": "Bulwark",
      "faction": "pyre",
      "hostFamily": null,
      "canon": "Heavy Pyre Purger built to stand in breach pressure longer than anyone, running heavy cannon or shotgun.",